{
  "name": "Food Delivery App",
  "budget_inr_per_month": 50000,
  "description": "We are building a food delivery app for 10,000 users per month.",
  "tech_stack": {
    "backend": "Node.js",
    "database": "PostgreSQL",
    "storage": "Object Storage",
    "monitoring": "Monitoring",
    "analytics": "Basic Analytics"
  },
  "non_functional_requirements": [
    "Scalability",
    "Cost Efficiency",
    "Uptime Monitoring"
  ]
}